{
  "schema_version": "0.4.0",
  "case_id": "cross_gen04_gen05_pass",
  "audit_record_path": "examples/conformance/records/audit-record.gen04.json",
  "purification_record_path": "examples/conformance/records/state-purification-record.gen04-gen05.json",
  "state_packet_path": "examples/conformance/records/state-packet.gen05.json",
  "expected_result": "PASS",
  "expected_violation_codes": []
}
